Index;Title;Lid;Text;Ner;Language;URL;Date13;Brand Analytics разработала технологию автоматического выявления агрессии в социальных медиа;https://zoom.cnews.ru/news/item/473231;"Под агрессией понимается направленное воздействие на объект с целью нанести ему ущерб. Прежде всего, это намеренное снижение статуса субъекта или объекта сообщения. По общепринятой классификации к агрессии относят харасмент, расизм, сексизм, троллинг, кибербуллинг (запугивание), и т.д.\nЕсли частному лицу в защите от виртуальных троллей помогает соблюдение несложных правил информационной гигиены, бизнесу уже не обойтись без «сигнальной системы», вовремя выявляющей очаги напряженности вокруг компании и бренда.\nТехнология автоматического выявления агрессии в русскоязычных соцмедиа Brand Analytics, по заявлению представителей компании-разработчика, является уникальной для России. Современные алгоритмы, использованные в системе Brand Analytics, позволяют не только выявить потенциальные угрозы, но и определить тип и направленность агрессии, понять ее источник и причину, а также интенсивность. Практический пример – обнаружение на начальной стадии инвективных мотивов в общении клиентской службы с пользователями в соцмедиа, что весьма актуально для розничного бизнеса.\nСистема Brand Analytics обнаруживает три основных типа агрессии: Opinion: реакция на событие + агрессивное возмущение; Trolling: агрессивная номинация + направленная агрессия + агрессивное намерение + агрессивное пожелание; Call: призыв к агрессии.\nТакже технология выявляет силу агрессии в обнаруженных сообщениях.\nНаталья Соколова, глава Brand Analytics, сказала: «Интеллектуальный анализ естественного языка (text mining) остается ключевым трендом в Big Data, так как позволяет выявлять не только факты, но и глубинные смыслы происходящего. Сегодня агрессия становится важной характеристикой эмотивного анализа текста, являясь маркером состояния социально-общественной деятельности людей. А автоматическое выявление агрессии дает возможность на ранней стадии обнаруживать проблемные зоны в инфополе как вокруг бизнеса, так и в социальной сфере, и предотвращать отрицательные последствия».\nСветлана Подгорная, советник по антикризисным коммуникациям Rights Business Standard, отметила: «Фильтр агрессии, примененный к объекту мониторинга, может, в частности, указывать на готовность пользователей к офлайн-активностям. Так, уровень вербальной агрессии обычно заметно повышается перед митингами. А повышение относительного количества агрессивных сообщений может указывать на формирование новой информационной волны – еще разряженной и не имеющей пока сформированного семантического ядра. Допустим, мы видим всплеск упоминаемости объекта, но не можем сходу определить, что его дает, сообщения на первый взгляд разрознены, в ""частотке"" нет новых слов, нет заметного массива репостов и дублей. Фильтрация по агрессии помогает сузить массив и выявить тему – без необходимости пристального изучения всех сообщений всплеска. Это хорошо помогает в оперативной обработке негативных и резонансных тем».";1;['ru', 'en'];https://zoom.cnews.ru/news/item/473231;
14;"""Яндекс"" показал зимние испытания беспилотников";https://rg.ru/2021/03/18/iandeks-pokazal-zimnie-ispytaniia-bespilotnikov.html;"Что касается пара, то нейросети способны распознавать его и отфильтровывать. Для этого нейронные сети предварительно обучают на записях, где завеса пара, а где физический объект. К слову, при помощи лидаров система может увидеть пешехода даже за облаком пара.\nСпециалисты ""Яндекса"" научили систему беспилотного управления определять коэффициент трения с дорожным покрытием. Благодаря чему беспилотник оценивает качество сцепления и выбирает скорость, длину тормозного пути, траекторию для маневров. Система планирует и другие дальнейшие действия. К примеру, стоит ли перестраиваться, какую дистанцию держать, за сколько замедляться перед светофором.\nНаконец, точно определять своё местоположение в полосе после снегопада беспилотным автомобилям помогает загруженная трёхмерная карта местности.\nПомимо этого, система беспилотного управления использует лидарное облако, показания инерциальных измерителей (IMU), одометрию. Данные с источников сопоставляются и выдается положение машины с высокой точностью. Также система обучена автоматически обновлять 3D-карту.";1;['ru', 'en'];https://rg.ru/2021/03/18/iandeks-pokazal-zimnie-ispytaniia-bespilotnikov.html;['2021/03/18']
15;Российские инженеры открыли скоростной способ обучения роботов;По мнению профессора Университета ИТМО Анатолия Шалыто, новая технология серьезно облегчит внедрение ИИ и в других сферах, в том числе тех, где широко представлен петербургский бизнес.;Причем, такая информация должна быть весьма разнообразной. Например, в сфере беспилотного управления транспортом нейронная сеть должна уметь с промышленной точностью распознавать объекты и тем самым обеспечивать безопасность при любых погодных условиях и времени суток. Для этого ее необходимо обучить, основываясь на данных, содержащих все возможные ситуации, которые могут повлиять на процесс управления.\nПока для обучения приходится использовать огромные массивы валовых данных, содержащих много «мусора» (повторяющихся ситуаций, нерепрезентативных данных и т.п.). Качественную информацию из них до сих пор извлекали вручную, что занимало чрезвычайно много времени.\n«Представьте, у нас длительность видеопотоков составляет более миллиарда кадров, — поясняет Юрий Минкин. — Просмотреть их полностью и произвести качественный отбор всех разнообразных изображений специалисту просто нереально. А в результате частичного отбора важные данные могут быть просто потеряны». Необходимость отбора репрезентативных данных из видеопотока до последнего времени являлась одним из главных препятствий в обучении нейронных сетей. Из-за этого, как утверждают специалисты, качественное обучение займет несколько лет, и только после этого ИИ в любой из возможных сфер его применения окажется способен хотя бы частично заменить человека.\nКак поясняют специалисты Cognitive Pilot, компания реализовала подход, который позволяет нейронной сети автоматически выбирать из видеопотока репрезентативные данные. «Мы используем метрику сравнения разных кадров. Так, в задаче автономного управления комбайном при его проезде по кромке мы выбираем кадры, в которых отклонения от среднего превышают определенную величину — например, на изображении появилась «проплешина» или торчащая из земли часть опоры. В результате система этот кадр берет. А при проезде лесополосы картинки хоть и меняются часто (мелькают кусты, деревья), но особого разнообразия в видеопотоке мы не наблюдаем — отклонение от среднего небольшое и такие данные автоматически отсеиваются». — рассказывает Юрий Минкин.\nПо его словам, новая технология позволяет отфильтровывать из видеопотока «мусорные» данные, никак не влияющие на процесс обучения. Например, процесс перегона комбайна с одного поля на другое, а также моменты, когда он стоит на месте или проходит по участку маршрута с пренебрежительно малыми изменениями полевой сцены. «Если раньше на обработку видеопотока при обучении нейронных сетей и создании датасетов могли уходить годы, то сегодня мы нажимаем на кнопку и получаем результат», — утверждает Юрий Минкин.\nhttps://www.rbc.ru/spb_sz/17/03/2021/6051b1099a7947600868f8e8;1;['ru', 'en'];https://www.rbc.ru/spb_sz/17/03/2021/6051b1099a7947600868f8e8;['17/03/2021']
16;Нейронные сети помогают новосибирским операторам Службы-112 в борьбе с COVID-19;Это стало возможным благодаря сотрудничеству министерства цифрового развития и связи региона с одним из мировых лидеров в области решений для интеллектуальной видеоаналитики – технологическим партнером госкорпорации Ростех, IT-компанией NtechLab. В результате нагрузка на операторов системы снизилась в 10 раз.;На первом этапе сравнение фотографий «вручную» делали операторы – им приходилось ежедневно просматривать тысячи фотографий в день, что приводило к задержкам верификации. Для автоматизации этого процесса и разгрузки операторов министерство цифрового развития и связи Новосибирской области обратилось к компании NtechLab с предложением интегрировать функции сопоставления селфи пользователей и получения степени схожести фотографий. Речь идет о применении технологий искусственных нейронных сетей (компьютерного зрения) в мобильном приложении «112-Экстренная помощь», которое является одним из модулей Системы-112 Новосибирской области.\n«Использование компьютерного зрения смогло облегчить тысячам новосибирцев процесс пребывания на самоизоляции, сократив до минимума время прохождения верификации. Не менее важным фактором является и уровень защиты персональных данных. Благодаря нашему сотрудничеству с ведущими IT-компаниями мы значительно улучшаем качество цифровых сервисов, предоставляемых жителям Новосибирской области», – отметил министр цифрового развития и связи региона Анатолий Дюбанов.\nОбщее количество пациентов с COVID-19, которые отправляли селфи во время нахождения на самоизоляции в 2020-2021 годах, превысило 13 000 человек. За этот период они отправили операторам более 244 000 селфи – операторам необходимо было обрабатывать в среднем 300-400 фото в день.\nСовременные технологии видеоаналитики с применением технологий искусственных нейронных сетей NtechLab позволили полностью автоматизировать процесс. Глубокая технологическая интеграция алгоритмов компании с программным решением была произведена в сжатые сроки – менее чем за месяц. Это позволило разгрузить работу операторов и значительно ускорить процесс идентификации людей на фотографиях. После внедрения компьютерного зрения он стал проходить автоматически, менее, чем за одну секунду, и сейчас операторы собственноручно отсматривают не более 30-40 фото в день. Человек подключается лишь в том случае, когда фото недостаточно четкое и требуется дополнительное подтверждение человеческим глазом.\nАнатолий Дюбанов подчеркнул, что в рамках взаимного сотрудничества планируется дальнейшее масштабирование компьютерного зрения на другие сферы, где требуется подтверждения личности через отправку фотографий.\nhttps://www.cnews.ru/news/line/2021-03-17_nejronnye_seti_pomogayut;1;['ru', 'en'];https://www.cnews.ru/news/line/2021-03-17_nejronnye_seti_pomogayut;['2021-03-17']
17;Яндекс пообещал операторам беспилотных автомобилей в США платить $20 в час;Недавно стало известно, что до конца 2020 года на дорогах России и США появятся сто новых беспилотных такси Яндекса. Тестирование будут проводить, в частности, в Москве, Иннополисе и Мичигане. Сегодня СМИ сообщили, что Яндекс пообещал операторам беспилотных автомобилей в США платить $20 в час.;Оператор беспилотника должен будет контролировать и оценивать его работу. А ещё по закону нужно, чтобы автомобиль на дороге не оставался пустым. От оператора требуют водительский стаж семь лет. Обещают платить $20 в час (около 1300 рублей по текущему курсу).;1;['ru'];https://www.ferra.ru/news/techlife/yandeks-poobeshal-operatoram-bespilotnykh-avtomobilei-v-ssha-platit-usd20-v-chas-10-06-2020.htm;['2020']
18;Эксперты допустили закрытие всех офисов банков США к 2034 году;К 2034 году банки США могут закрыть все отделения, если принципы их работы не изменятся. К такому выводу пришли эксперты финтех-стартапа Self Financial. Они изучили изменения в потребительском банкинге и сделали прогнозы на следующие 15 лет.;Традиционные банки с сетью отделений будут меняться:\nАвторы исследования ожидают, что вскоре в банках будет все меньше клерков, функции которых возьмет на себя искусственный интеллект. Будут активнее внедряться рекомендательные системы с использованием искусственного интеллекта для того, чтобы предоставлять клиентам наиболее подходящие продукты, а также для консультирования относительно инвестиций и сбережений.\nФункционал банкоматов станет шире — они будут использоваться для получения дополнительных услуг и отчасти также заменят банковских служащих.\nБанки станут активнее внедрять биометрические и криптографические системы для защиты данных и повышения безопасности при предоставлении услуг и проведении операций.\nСократится количество традиционных банков, в том числе из-за развития систем с использованием искусственного интеллекта и влияния пандемии на банковский бизнес. Часть услуг, ранее доступных только в отделении банка, будет оказываться в его приложении.\nВ результате сокращения расходов банков снизятся комиссии — клиенты смогут ощутить это за счет роста процентных ставок или в виде сокращения комиссионных платежей.\nМетодология. Исследование опирается на данные компании Statista, которые были обработаны в течение августа 2020 года. Опрос среди 1114 американцев был проведен с помощью платформы Amazon Mechanical Turk. Опрос проводился в онлайн-формате в период с 28 июля по 1 августа 2020 года. \nЗачем вам об этом знать. Исследование показывает, как меняются привычки и ожидания клиентов банков США. Некоторые из описанных экспертами трендов могут быть характерны и для российских пользователей.\nhttps://frankrg.com/38847;1;['ru', 'en'];https://frankrg.com/38847;
