Index;Title;Lid;Text;Ner;Language;URL;Date16;Нейронные сети помогают новосибирским операторам Службы-112 в борьбе с COVID-19;Это стало возможным благодаря сотрудничеству министерства цифрового развития и связи региона с одним из мировых лидеров в области решений для интеллектуальной видеоаналитики – технологическим партнером госкорпорации Ростех, IT-компанией NtechLab. В результате нагрузка на операторов системы снизилась в 10 раз.;На первом этапе сравнение фотографий «вручную» делали операторы – им приходилось ежедневно просматривать тысячи фотографий в день, что приводило к задержкам верификации. Для автоматизации этого процесса и разгрузки операторов министерство цифрового развития и связи Новосибирской области обратилось к компании NtechLab с предложением интегрировать функции сопоставления селфи пользователей и получения степени схожести фотографий. Речь идет о применении технологий искусственных нейронных сетей (компьютерного зрения) в мобильном приложении «112-Экстренная помощь», которое является одним из модулей Системы-112 Новосибирской области.\n«Использование компьютерного зрения смогло облегчить тысячам новосибирцев процесс пребывания на самоизоляции, сократив до минимума время прохождения верификации. Не менее важным фактором является и уровень защиты персональных данных. Благодаря нашему сотрудничеству с ведущими IT-компаниями мы значительно улучшаем качество цифровых сервисов, предоставляемых жителям Новосибирской области», – отметил министр цифрового развития и связи региона Анатолий Дюбанов.\nОбщее количество пациентов с COVID-19, которые отправляли селфи во время нахождения на самоизоляции в 2020-2021 годах, превысило 13 000 человек. За этот период они отправили операторам более 244 000 селфи – операторам необходимо было обрабатывать в среднем 300-400 фото в день.\nСовременные технологии видеоаналитики с применением технологий искусственных нейронных сетей NtechLab позволили полностью автоматизировать процесс. Глубокая технологическая интеграция алгоритмов компании с программным решением была произведена в сжатые сроки – менее чем за месяц. Это позволило разгрузить работу операторов и значительно ускорить процесс идентификации людей на фотографиях. После внедрения компьютерного зрения он стал проходить автоматически, менее, чем за одну секунду, и сейчас операторы собственноручно отсматривают не более 30-40 фото в день. Человек подключается лишь в том случае, когда фото недостаточно четкое и требуется дополнительное подтверждение человеческим глазом.\nАнатолий Дюбанов подчеркнул, что в рамках взаимного сотрудничества планируется дальнейшее масштабирование компьютерного зрения на другие сферы, где требуется подтверждения личности через отправку фотографий.\nhttps://www.cnews.ru/news/line/2021-03-17_nejronnye_seti_pomogayut;1;['ru', 'en'];https://www.cnews.ru/news/line/2021-03-17_nejronnye_seti_pomogayut;['2021-03-17']
17;Яндекс пообещал операторам беспилотных автомобилей в США платить $20 в час;Недавно стало известно, что до конца 2020 года на дорогах России и США появятся сто новых беспилотных такси Яндекса. Тестирование будут проводить, в частности, в Москве, Иннополисе и Мичигане. Сегодня СМИ сообщили, что Яндекс пообещал операторам беспилотных автомобилей в США платить $20 в час.;Оператор беспилотника должен будет контролировать и оценивать его работу. А ещё по закону нужно, чтобы автомобиль на дороге не оставался пустым. От оператора требуют водительский стаж семь лет. Обещают платить $20 в час (около 1300 рублей по текущему курсу).;1;['ru'];https://www.ferra.ru/news/techlife/yandeks-poobeshal-operatoram-bespilotnykh-avtomobilei-v-ssha-platit-usd20-v-chas-10-06-2020.htm;['2020']
18;Эксперты допустили закрытие всех офисов банков США к 2034 году;К 2034 году банки США могут закрыть все отделения, если принципы их работы не изменятся. К такому выводу пришли эксперты финтех-стартапа Self Financial. Они изучили изменения в потребительском банкинге и сделали прогнозы на следующие 15 лет.;Традиционные банки с сетью отделений будут меняться:\nАвторы исследования ожидают, что вскоре в банках будет все меньше клерков, функции которых возьмет на себя искусственный интеллект. Будут активнее внедряться рекомендательные системы с использованием искусственного интеллекта для того, чтобы предоставлять клиентам наиболее подходящие продукты, а также для консультирования относительно инвестиций и сбережений.\nФункционал банкоматов станет шире — они будут использоваться для получения дополнительных услуг и отчасти также заменят банковских служащих.\nБанки станут активнее внедрять биометрические и криптографические системы для защиты данных и повышения безопасности при предоставлении услуг и проведении операций.\nСократится количество традиционных банков, в том числе из-за развития систем с использованием искусственного интеллекта и влияния пандемии на банковский бизнес. Часть услуг, ранее доступных только в отделении банка, будет оказываться в его приложении.\nВ результате сокращения расходов банков снизятся комиссии — клиенты смогут ощутить это за счет роста процентных ставок или в виде сокращения комиссионных платежей.\nМетодология. Исследование опирается на данные компании Statista, которые были обработаны в течение августа 2020 года. Опрос среди 1114 американцев был проведен с помощью платформы Amazon Mechanical Turk. Опрос проводился в онлайн-формате в период с 28 июля по 1 августа 2020 года. \nЗачем вам об этом знать. Исследование показывает, как меняются привычки и ожидания клиентов банков США. Некоторые из описанных экспертами трендов могут быть характерны и для российских пользователей.\nhttps://frankrg.com/38847;1;['ru', 'en'];https://frankrg.com/38847;
19;Неожиданно: первой платформой Qualcomm со встроенным модемом 5G станет 7-нанометровая Snapdragon 735;В Сети появились подробности о новой однокристальной платформе Qualcomm – Snapdragon 735. И самое интересное, что можно почерпнуть из опубликованного источником перечня ее характеристик, - наличие встроенного модема 5G. Такового нет даже во флагманской Snapdragon 855 (и не планируется в идущей ей на смену Snapdragon 865).;Если эти данные окажутся правдой, то первыми по-настоящему массовыми смартфонами с поддержкой 5G станут не флагманы, а модели среднего уровня – на базе Snapdragon 735. Впрочем, есть у платформы и другие особенности.\nВо-первых, CPU будет представлено схемой «1+1+6 ядер». Первые два – высокопроизводительные Kryo 4XX, но с разной тактовой частотой – 2,9 и 2,4 ГГц. Еще шесть – энергоэффективные Kryo 4XX частотой 1,8 ГГц. GPU Adreno 620 частотой 750 МГц – практически флагманское решение. Для сравнения, в Snapdragon 845 используется GPU Adreno 630 частотой 710 МГц. Третье ключевое составляющее платформы – нейронный процессор NPU 220 частотой 1 ГГц.\nНеожиданно: первой платформой Qualcomm со встроенным модемом 5G станет 7-нанометровая Snapdragon 735\nТакже платформа обеспечит поддержку до 16 ГБ оперативной памяти LPDDR4x частотой до 2133 МГц, дисплеи разрешением до 3360 х 1440 пикселей с HDR10 и аппаратное декодирование видео 4К с кадровой частотой 60 к/с. SoC будет производиться по технологическим нормам 7 нм.\nУвы, о сроках выпуска новой платформы ничего не сообщается. Но вряд ли она появится раньше четвертого квартала текущего года, ведь совсем недавно вышли SoC Sanpdragon 730 и 730G. Ну а готовые решения на ее основе логично ждать весной следующего года.\nhttps://www.ixbt.com/news/2019/04/20/qualcomm-5g-7-snapdragon-735.html;1;['ru', 'en'];https://www.ixbt.com/news/2019/04/20/qualcomm-5g-7-snapdragon-735.html;['2019/04/20']
20;MTS StartUp Hub: как за два месяца получить крупного клиента;https://vc.ru/mtsstartuphub/223964-mts-startup-hub-kak-za-dva-mesyaca-poluchit-krupnogo-klienta;"Программа акселерации рассчитана на два месяца. За это время технологические команды готовятся запустить пилотный проект с бизнес-вертикалями корпорации и определяют KPI. На предпилотную подготовку МТС выделяет 200 тысяч рублей каждому резиденту.\nПосле прохождения этого этапа резиденты центра запускают пилот вместе с МТС. На него корпорация готова выделить до 500 тысяч рублей.\nКак происходит масштабирование после пилота?\nВ зависимости от условий пилота и стратегии развития бизнес-заказчиков, стартапу после успешного прохождения пилотирования могут предложить несколько вариантов масштабирования:\n- выкуп лицензии на решение стартапа;\n- запуск совместного предприятия;\n- revenue sharing — решение стартапа распространяется через каналы продаж МТС, выручка от продаж делится между корпорацией и технологической командой;\n- продажа компании с последующей интеграцией команды в МТС;\n- инвестиции от венчурного фонда МТС.";1;['ru', 'en'];https://vc.ru/mtsstartuphub/223964-mts-startup-hub-kak-za-dva-mesyaca-poluchit-krupnogo-klienta;
