Index;Title;Lid;Text;Ner;Language;URL;Date24;«Нарисовать» портрет пользователя из соцсети;В современном мире автоматизированный анализ текстовых документов имеет широкую практику применения: например, при подборе кадров, для получения объективной информации о внутренней атмосфере в компании, выявления лидеров или социальных связей, а также при разработке новых систем проверки всякого рода текстовых документов.;Оценка текстовых данных специалистами Ульяновского государственного технического университета основана на использовании методов семантического анализа тематики слабоструктурированных текстовых данных пользователя (посты, комментарии) с применением предметной онтологии. Анализ эмоциональной окраски постов социальной сети осуществлен при помощи алгоритмов «word2vec» и «BERT». Подход матчинга (сопоставления) профилей пользователей в социальных сетях представляет собой приложение, распознающее структурированную информацию.\nРабота с социальными сетями и содержательный анализ собранной в социальных сетях информации, которую ульяновские ученые обрабатывают в своей программной системе, осуществляется автоматически через отдельный модуль системы с использованием соответствующих API социальных сетей. Анализируются только открытые данные, к закрытым данным доступа нет.\nЭксперименты по построению социального портрета также проводились на открытых данных пользователей социальной сети ВКонтакте. Разработанный ульяновскими исследователями алгоритм может дать объективное представление о личностных, психофизиологических и деловых качествах человека, например, рекрутинговым компаниям.\nСпециалисты УлГТУ применили свою методику, главная особенность которой, помимо глубокого статистического анализа динамики активности пользователя в разных социальных сетях, по словам Мошкина, «это анализ его сообщений, постов и статусов, т.е. текстовой информации. Анализ семантики (т.е. смысла) текстовых данных, написанных непосредственно пользователем, позволяет определить отношение человека к объектам реального мира, явлениям, событиям, персоналиям, его интересы, а также провести психолингвистический анализ согласно пятифакторному методу оценки личности («метод Большой пятерки»). Как отметил ученый, «эксперименты по построению социального портрета в социальной сети ВКонтакте показали прямую зависимость между качеством семантического анализа данных человека и объемом неструктурированных данных с его страниц в социальных сетях».\nСуть проекта, как пояснил Вадим Мошкин,  заключается в реализации предложенных ранее моделей, методов и алгоритмов (метод объединения (матчинга) профилей, алгоритм унификация данных, статистического анализа динамики активности пользователя, семантико-когнитивного и сентимент-анализа текстов, а также психолингвистического анализа постов пользователей) в виде программного сервиса с дальнейшим выводом на рынок».\nТаким образом, методики получения социального портрета пользователя из пространства глобальной сети интернет, предлагаемые инженерами УлГТУ, демонстрируют действенный интеллектуальный продукт, который позволяет идентифицировать человека и сформировать модель его профиля.\nhttps://scientificrussia.ru/articles/narisovat-portret-polzovatelya-iz-sotsseti;1;['ru', 'en'];https://scientificrussia.ru/articles/narisovat-portret-polzovatelya-iz-sotsseti;
25;Apple уже пятый год массово скупает компании, работающие над искусственным интеллектом;В течение нескольких последних лет Apple купила такие компании, как Emotient, Turi, Glimpse, RealFace, Shazam, SensoMotoric, Silk Labs, Drive.ai, Laserlike, SpectralEdge, Voysis, XNOR.ai и многие другие. Целью этих приобретений является совершенствование возможностей ИИ и машинного обучения продуктов Apple. Компания не разглашает все свои приобретения, поэтому вполне возможно, что калифорнийскому техногиганту принадлежит гораздо больше компаний, работающих с ИИ.;Большинство приобретений Apple в сфере ИИ направлены на совершенствование голосового помощника Siri. Компания приобрела Inductiv, чтобы улучшить обработку данных голосовым помощником, а наработки Voysis помогли Siri улучшить понимание живой человеческой речи. Многие приобретения нацелены на будущие продукты компании в сфере искусственного интеллекта.\nGlobalData также сообщает, что Apple, Accenture, Google, Microsoft и Facebook за 2020 год наняли более 14 тысяч сотрудников, специализирующихся на искусственном интеллекте и технологиях машинного обучения.\nhttps://3dnews.ru/1035800/apple-uge-pyatiy-god-massovo-skupaet-kompanii-rabotayushchie-nad-iskusstvennim-intellektom;1;['ru', 'en'];https://3dnews.ru/1035800/apple-uge-pyatiy-god-massovo-skupaet-kompanii-rabotayushchie-nad-iskusstvennim-intellektom;
Index;Title;Lid;Text;Ner;Language;URL;Date
1;ЕС намерен защитить людей от искусственного интеллекта;Восторг от удобств, созданных технологиями искусственного интеллекта, сменяется тревогой, вызванной его неуправляемостью человеком. Самообучающиеся системы признаются революционными технологиями, претендующими на замену человеческого интеллекта во многих областях. ЕС одним из первых поднял вопрос о нарушении прав человека при использовании искусственного интеллекта в процессах принятия решений.;"В Декларации звучит призыв обеспечить при использовании алгоритмов ИИ справедливость и выполнение требований этических норм для всех людей.\nНерегулируемое развитие компьютеризированных или автоматизированных систем принятия решений в сочетании с отсутствием прозрачности и недостаточным общественным контролем, а также их использование в предоставлении социальных услуг создает определенные риски. Если эти системы не будут разработаны и использованы в соответствии с принципами прозрачности и правовой определенности, они могут усилить предвзятость и повысить социальные риски. Впоследствии это может привести к более сильному негативному воздействию на наиболее уязвимых членов общества.\nПредвзятые или ошибочные автоматизированные решения могут привести к увеличению бедности, крайней нищете или даже появлению большего количества бездомных и причинить серьезный или непоправимый вред людям.\nВ Декларации подчеркивается, что при принятии Повестки Организации Объединенных Наций в области устойчивого развития на период до 2030 года все государства — члены Совета Европы подтвердили, что достоинство человека имеет основополагающее значение.\nВ Декларации Комитет министров обращает особое внимание государств — членов ЕС на следующие проблемы:\nвозможные риски для прав человека, включая социальные права, которые могут возникнуть в результате принятия государственными органами решений с помощью компьютера или ИИ;\nнеобходимость обеспечения разработки и внедрения систем принятия решений с использованием компьютеров или искусственного интеллекта в соответствии с принципами правовой определенности, законности, качества данных, исключение дискриминации и непрозрачности;\nнеобходимость надзора со стороны человека за решениями, принимаемыми с помощью компьютера или ИИ, с целью смягчения и предотвращения нарушения социальных прав людей;\nнеобходимость эффективных мер по защите людей от непоправимого вреда, включая бедность, крайнюю нищету или бездомность, в результате реализации решений ИИ в области социальных услуг;\nпотребность в ответственности и подотчетности субъектов ИИ, занимающихся проектированием, разработкой, развертыванием или оценкой систем ИИ;\nпроактивный подход для обеспечения возможности отстаивания своих социальных прав теми людьми, кого затрагивают решения ИИ.\nПодробности: https://regnum.ru/news/polit/3218949.html";1;['ru', 'en'];https://regnum.ru/news/polit/3218949.html;
2;LG представила систему «Умный дом» и новинки бытовой техники 2019;https://android-robot.com/lg-predstavila-sistemu-umnyj-dom-i-novinki-bytovoj-texniki-2019;;0;['en'];https://android-robot.com/lg-predstavila-sistemu-umnyj-dom-i-novinki-bytovoj-texniki-2019;['2019']
3;В США оценили позиции стран-конкурентов в гонке ИИ;Американская некоммерческая организация Information Technology and Innovation Foundation (Фонд информационных технологий и инноваций), недавно представила широкой общественности тематический отчет, посвященный вопросам лидерства в сфере искусственного интеллекта на уровне государств. Согласно основным выводам — США, как и ранее, возглавляет рейтинг, но Китай ускоренным темпом сокращает отставание и в ближайшее время может перейти со второй на первую позицию. В то же время, ЕС теряет позиции, хотя и находится на третьем месте.;Исследователи отметили, что США лидируют по таким параметрам, как инвестиции в стартапы, связанные с ИИ, и финансирование исследований и разработок. Что же касается Европы, то она наоборот заметно отстает по объемам финансирования венчурного капитала и прямых инвестиций в ИИ. Также США по-прежнему являются мировым лидером в сфере разработки микросхем для систем искусственного интеллекта.\nВ некоторых других областях Китай уже опережает США. Например, в прошлом году, на территории страны работало 214 суперкомпьютеров из рейтинга ТОР-500 мощнейших вычислительных систем мира. Для сравнения, в США таковых было 113, а в ЕС — 91.\nЧто касается количества опубликованных исследовательских работ, то здесь также лидирует Китай. Учеными из КНР за 2020 г. было опубликовано 24 929 научных работ по теме ИИ, для США этот показатель составил 20 418, для ЕС — 16 233. В то же время отмечается, что несмотря на количественные показатели, в общем и целом качество исследований в США по-прежнему выше, чем в Китае и Европейском Союзе.\nСША занимает первое место в рейтинге ITIF, при этом Китай ускоренным темпом сокращает отставание и в ближайшее время может перейти со второй на первую позицию\n«Китайское правительство сделало ИИ своим главным приоритетом, и результаты налицо. США и ЕС необходимо обратить внимание на то, что делает Китай, и реагировать на сложившуюся ситуацию, потому что страны, которые лидируют в разработке и использовании искусственного интеллекта, будут определять будущее. Они значительно улучшат конкурентоспособность своих экономик, в то время как отстающие страны рискуют потерять позиции в ключевых отраслях», — считает Даниэль Кастро, директор Центра инноваций и основной автор отчета.\n«Применение искусственного интеллекта дает неоспоримые преимущества, и за прошедший год мы в этом смогли убедиться. Освоение новых технологий, в особенности ИИ, стало одной из антикризисных мер во многих отраслях во время пандемии. За 2020 г. выросло количество успешно внедренных бизнес-кейсов, но это скорее тактические шаги. Стратегически, в долгосрочной перспективе, конечно, фундаментальные научные исследования и поддержка со стороны государства важны для развития искусственного интеллекта не меньше, чем финансирование разработок и спрос со стороны бизнеса», — говорит Александр Тихонов, генеральный директор SAS Россия/СНГ.\nПодводя итоги, авторы из ITIF говорят о том, что для сохранения конкурентоспособности в сфере ИИ, Европе необходимо ввести дополнительные налоговые льготы, направленные на активизацию исследований и расширить возможности государственных НИИ, работающих над технологиями искусственного интеллекта. В свою очередь, США чтобы сохранить лидерство, должны усилить поддержку исследований и внедрений ИИ, а также активизировать программы, связанные с развитием человеческого капитала в области ИИ, в том числе за счет привлечения талантов со всего мира.\nhttps://ai.cnews.ru/news/top/2021-03-18_v_ssha_otsenili_pozitsii_strankonkurentov;1;['ru', 'en'];https://ai.cnews.ru/news/top/2021-03-18_v_ssha_otsenili_pozitsii_strankonkurentov;['2021-03-18']
4;Эксперты: Клавиатуры уйдут в прошлое;URL: https://hightech.plus/2019/04/19/ekspert-cherez-pyat-let-klaviaturi-uidut-v-proshloe;«Голосового бота сегодня все сложнее отличить от человека»\nИнвестор говорит, что сейчас в сообществе не сложилось единого мнения о том, что представляют из себя голосовые ассистенты — удобную надстройку или же «изменение опыта взаимодействия с пользователем катастрофической силы». В Mangrove придерживаются второго мнения: «Что мне сегодня ясно, так это что клавиатуры через пять лет исчезнут в качестве средства ввода информации».\n«Голос — это возможность десятилетия. Я оптимист, но оптимист, который достаточно часто бывал прав», — усмехается Тлузц.\nCNBC отмечает, что сейчас на рынке голосовых ассистентов доминируют гиганты — Amazon, Google, Apple. И там вполне разделяют видение инвестора о глобальном воздействии голосовых интерфейсов.\nНо Тлуцз уверен, что у молодых компаний есть шансы закрепиться на этом рынке или создать новые ниши. «Через несколько лет будут [бизнес-модели], опирающиеся исключительно на голос».\nДля Mangrove «точкой входа» на новый рынок стал французский стартап Sybel, который специализируется на создании высококачественных стартапов. Если ставка Тлузца верна, рынок в ближайшие годы вырастет во много раз.\nИ он не единственный, кто так считает. Аналитическая компания Juniper Research посчитала, что к концу 2018 года на различных устройствах по всему миру использовалось около 2,5 млрд голосовых помощников. К концу 2023 года эта цифра достигнет 8 млрд.;1;['ru', 'en'];https://hightech.plus/2019/04/19/ekspert-cherez-pyat-let-klaviaturi-uidut-v-proshloe;['2019/04/19']
